{
  "schema_version": "vllm-gr.daily.v1",
  "run": {
    "id": "daily-offline-2026-09-10-e936a271-bw128-in1024-c1",
    "date": "2026-09-10",
    "started_at": "2026-09-10T02:32:57.355047+08:00",
    "finished_at": "2026-09-10T02:34:57.607848+08:00",
    "status": "success",
    "trend_eligible": true,
    "baseline_eligible": true,
    "qualification_reasons": [],
    "notes": [
      "Offline GRLLM.beam_search; max_concurrency=1 and one prompt per call.",
      "Canonical E2E is measured before diagnostic sampling with one outer perf_counter_ns and no internal monkeypatch or profiler.",
      "Each canonical sample is a cold-cache call followed by an identical warm-cache call.",
      "Offline E2E excludes HTTP, SSE, serialization, and network round-trip overhead.",
      "Internal stage values come from a smaller post-canonical diagnostic sample and never contribute to the official E2E trend.",
      "Worker pipeline comes from a separate post-matrix process; formal E2E and stage metrics are unchanged."
    ]
  },
  "source": {
    "repository": "vllm-gr",
    "git_sha": "e936a27111f405ac17356a69f1044f7ddc29594b",
    "git_subject": "feat: scaffold async beam_search_v1 execution (#342)",
    "branch": "decode_graph",
    "tracked_clean": true,
    "change_since_previous": {
      "previous_git_sha": "fc4047d71a23227ebe9b6bd6ee763bd5c9cac5a8",
      "current_git_sha": "e936a27111f405ac17356a69f1044f7ddc29594b",
      "comparison_scope": "previous successful daily HEAD to current daily HEAD",
      "commit_count": 2,
      "commits": [
        {
          "git_sha": "3d6b6398750313d6674b559d846fa3c08cfd6beb",
          "subject": "fix(beam): preserve cumulative parent scores and generated output bou… (#354)",
          "committed_at": "2026-09-09T17:22:05+08:00",
          "pull_request_numbers": [
            354
          ]
        },
        {
          "git_sha": "e936a27111f405ac17356a69f1044f7ddc29594b",
          "subject": "feat: scaffold async beam_search_v1 execution (#342)",
          "committed_at": "2026-09-09T22:25:06+08:00",
          "pull_request_numbers": [
            342
          ]
        }
      ],
      "pull_requests": [
        {
          "number": 354,
          "title": "fix(beam): preserve cumulative parent scores and generated output bou…",
          "url": "https://github.com/JiusiServe/vllm-gr/pull/354",
          "git_sha": "3d6b6398750313d6674b559d846fa3c08cfd6beb"
        },
        {
          "number": 342,
          "title": "feat: scaffold async beam_search_v1 execution",
          "url": "https://github.com/JiusiServe/vllm-gr/pull/342",
          "git_sha": "e936a27111f405ac17356a69f1044f7ddc29594b"
        }
      ],
      "previous_is_ancestor": true
    }
  },
  "environment": {
    "host": "L20",
    "hardware": "L20",
    "gpu": {
      "count": 1,
      "name": "NVIDIA L20",
      "memory_mib": 46068,
      "driver_version": "570.211.01"
    },
    "container": {
      "name": "vllm-gr-benchmark-gpu1",
      "image": "vllm-gr:dev",
      "image_digest": null
    },
    "runtime": {
      "vllm_version": "0.22.1",
      "vllm_gr_version": "0.22.1",
      "torch_version": "2.11.0+cu130",
      "cuda_forward_compat": true
    }
  },
  "model": {
    "id": "OpenOneRec/OneRec-1.7B",
    "revision": null,
    "generation_config_source": "model"
  },
  "dataset": {
    "name": "OpenOneRec/OpenOneRec-RecIF",
    "kind": "real",
    "representative": true,
    "task": "video",
    "path": "/opt/vllm-gr/data/video/video_test.parquet",
    "revision": "8f7cf2ee0b949e955a87a708d02024687be232c8",
    "sha256": "66079915e3c3daab7df3487f9babb658df99ec1672c3ef42d7893d87cef2e6d8",
    "selection": {
      "strategy": "seeded-sample",
      "seed": 42,
      "sample_count": 100,
      "sample_ids_sha256": "48ed79ffcb501b982ec4343816e45477264c362781eb0881a066cf45be0f1afa",
      "shuffle": true
    }
  },
  "scenario": {
    "key": "bw128-in1024",
    "name": "RecIF video · beam-128 · input-1024 · offline-c1",
    "execution_mode": "offline",
    "endpoint": "GRLLM.beam_search",
    "backend": "vllm-gr-offline",
    "num_prompts": 100,
    "max_concurrency": 1,
    "request_rate": "sequential",
    "beam_search": true,
    "n": 128,
    "input_tokens_target": 1024,
    "input_tokens_observed": {
      "min": 1024,
      "mean": 1024.0,
      "max": 1024
    },
    "sweep": {
      "axis": "beam_width",
      "beam_width": 128,
      "input_tokens": 1024
    },
    "warmup_requests": 4,
    "server_args": {
      "attention_backend": "CUSTOM",
      "beam_graph_enabled": true,
      "beam_max_width": 128,
      "max_logprobs": 1024,
      "max_num_seqs": 1024,
      "max_num_batched_tokens": 16384,
      "max_model_len": 8192,
      "scheduling_policy": "priority",
      "single_request": true,
      "beam_engine_driven": null
    },
    "benchmark_args": {
      "temperature": 0,
      "max_tokens": 5,
      "phase_definition": {
        "version": "vllm-gr-canonical-e2e-v1",
        "e2e": "unmodified direct GRLLM.beam_search call start through return",
        "cache_protocol": "paired cold miss followed by identical warm hit",
        "internal_stages": "reported separately from post-canonical diagnostic samples"
      },
      "measurement_mode": "canonical-with-posthoc-diagnostic",
      "instrumentation": {
        "canonical": "top-level perf_counter_ns only; no profiler or internal monkeypatch",
        "diagnostic": "post-canonical minimal 2-function perf_counter monkeypatch (prefill/decode boundary only)",
        "canonical_contaminated_by_diagnostic": false
      },
      "diagnostic_prompts": 0,
      "cache_protocol": "paired-reset-then-repeat",
      "metric_percentiles": [
        50,
        90,
        95,
        99
      ],
      "save_detailed": true
    }
  },
  "results": {
    "requests": {
      "completed": 100,
      "failed": 0
    },
    "duration_seconds": 9.515211335,
    "tokens": {
      "input_total": 102400,
      "output_total": 64000,
      "output_semantics": "beam-aggregate"
    },
    "throughput": {
      "requests_per_second": 10.50948806908449,
      "output_tokens_per_second": 6726.072364214074,
      "total_tokens_per_second": 17487.78814695659
    },
    "latency_ms": {
      "e2el": {
        "mean": 95.15211335,
        "std": 1.1183794421048017,
        "p50": 95.14615900000001,
        "p90": 96.50502920000001,
        "p95": 97.12025820000001,
        "p99": 97.96367327,
        "unit": "ms"
      },
      "e2el_hit": {
        "mean": 63.48570651,
        "std": 1.326224382399701,
        "p50": 63.485658,
        "p90": 64.72048389999999,
        "p95": 65.44837919999999,
        "p99": 67.31311796000001,
        "unit": "ms"
      }
    },
    "beam_search": null,
    "cpu_pipeline_detail": {
      "schema_version": "vllm-gr.cpu-timing.v1",
      "method": "perf_counter_ns + thread_time_ns; in-memory aggregation; flush at worker shutdown",
      "hot_path_io": false,
      "perturbation_validation": {
        "status": "pending",
        "method": "same-scenario LIGHTWEIGHT_TIMING=0 versus 1",
        "limits_percent": {
          "p50": 2.0,
          "p90": 3.0,
          "p99": 5.0
        }
      },
      "source_files": 1,
      "metrics": {
        "scheduler_schedule": {
          "count": 1616,
          "wall_mean_ms": 0.2199436082920792,
          "wall_p50_ms": 0.193003,
          "wall_p90_ms": 0.402574,
          "wall_p99_ms": 0.41213255000000004,
          "wall_total_ms": 355.428871,
          "thread_cpu_mean_ms": 0.22015580507425742,
          "thread_cpu_p50_ms": 0.19351500000000002,
          "thread_cpu_total_ms": 355.771781,
          "unit": "ms"
        },
        "update_states": {
          "count": 808,
          "wall_mean_ms": 0.31527319678217824,
          "wall_p50_ms": 0.311044,
          "wall_p90_ms": 0.32313349999999996,
          "wall_p99_ms": 0.35117044000000003,
          "wall_total_ms": 254.740743,
          "thread_cpu_mean_ms": 0.3160132227722772,
          "thread_cpu_p50_ms": 0.31175050000000004,
          "thread_cpu_total_ms": 255.338684,
          "unit": "ms"
        },
        "prepare_inputs": {
          "count": 808,
          "wall_mean_ms": 1.0105043886138614,
          "wall_p50_ms": 0.9984040000000001,
          "wall_p90_ms": 1.0156718,
          "wall_p99_ms": 1.11098439,
          "wall_total_ms": 816.487546,
          "thread_cpu_mean_ms": 1.0118091683168318,
          "thread_cpu_p50_ms": 1.000015,
          "thread_cpu_total_ms": 817.541808,
          "unit": "ms"
        },
        "determine_batch": {
          "count": 808,
          "wall_mean_ms": 0.04388803341584158,
          "wall_p50_ms": 0.0422895,
          "wall_p90_ms": 0.04971179999999999,
          "wall_p99_ms": 0.06241901,
          "wall_total_ms": 35.461531,
          "thread_cpu_mean_ms": 0.04292392945544554,
          "thread_cpu_p50_ms": 0.041301500000000005,
          "thread_cpu_total_ms": 34.682535,
          "unit": "ms"
        },
        "prepare_attn_buffers": {
          "count": 808,
          "wall_mean_ms": 0.04073082673267327,
          "wall_p50_ms": 0.0389765,
          "wall_p90_ms": 0.0465504,
          "wall_p99_ms": 0.05993238999999999,
          "wall_total_ms": 32.910508,
          "thread_cpu_mean_ms": 0.04095682054455446,
          "thread_cpu_p50_ms": 0.0391875,
          "thread_cpu_total_ms": 33.093111,
          "unit": "ms"
        },
        "prepare_attn_metadata": {
          "count": 808,
          "wall_mean_ms": 0.5522985594059406,
          "wall_p50_ms": 0.739023,
          "wall_p90_ms": 0.7559492,
          "wall_p99_ms": 0.7902061399999999,
          "wall_total_ms": 446.257236,
          "thread_cpu_mean_ms": 0.5535726967821782,
          "thread_cpu_p50_ms": 0.7408285,
          "thread_cpu_total_ms": 447.286739,
          "unit": "ms"
        },
        "preprocess_model_inputs": {
          "count": 808,
          "wall_mean_ms": 0.023678659653465346,